Tech Stack,Use Case,Results,Link
Python,Automated Invoice Processing for Retail,Saved 40 hours/week,atliq.com/invoice-case-study
React Native,Mobile Banking App for Fintech,Increased user engagement by 30%,atliq.com/fintech-app
AWS & Snowflake,Data Warehousing for E-commerce,Reduced latency by 50%,atliq.com/data-warehouse
React & Node.js,Patient Management System for Healthcare,Digitized 1M+ records,atliq.com/healthcare-portal
TensorFlow,Demand Forecasting for Supply Chain,Reduced inventory waste by 15%,atliq.com/supply-chain-ai
PHP & Laravel,Legacy Migration for Insurance,Modernized 20-year old system,atliq.com/insurance-migration
Flutter,Real Estate Marketplace App,100k+ downloads in 3 months,atliq.com/real-estate-app
Django,Cybersecurity Audit Dashboard,Detected 500+ vulnerabilities,atliq.com/security-dash
Vue.js,E-learning Platform for K-12,Onboarded 50k students,atliq.com/edtech-platform
Java & Spring Boot,High-Frequency Trading Engine,Handled 1M transactions/sec,atliq.com/trading-engine